context;stimulus;opt1;opt2;ask_justification
Лошадь принесла четырёх котят в корзинку, а одного оставила во дворе.;Лошадь принесла всех котят в корзинку.;Правильно;*Неправильно;да
Каждый из трёх мальчиков поймал по одной рыбе.;Каждый мальчик поймал рыбу.;*Правильно;Неправильно;нет
Из пяти учеников задачу решили только двое.;Все ученики решили задачу.;Правильно;*Неправильно;да
Маша съела половину яблока, а вторую половину оставила брату.;Маша съела не всё яблоко.;*Правильно;Неправильно;нет
Медведь нашёл горшочек с мёдом и съел весь мёд.;В горшочке остался мёд.;Правильно;*Неправильно;да
